{
  "schema_version": "1.0.0",
  "program": {
    "program_id": "EE2",
    "program_code": "EE2",
    "name": "Kỹ thuật Điều khiển - Tự động hóa",
    "curriculum_version": "2023",
    "degree_level": "BACHELOR",
    "total_required_credits": 132
  },
  "sources": [
    {
      "id": "public_curriculum_ee2",
      "kind": "PUBLIC_HUST_CURRICULUM_EXTRACTION",
      "file": "data/raw/official_curricula/EE2-2023.json",
      "sha256": "abdc7f6c2d65e410671b7a508ef8c53a7ee7f8ef2d53e6520b84430ba562dff9",
      "authority": "Đại học Bách khoa Hà Nội / đơn vị quản lý chương trình",
      "contains_personal_data": false,
      "personal_data_included_in_output": false
    }
  ],
  "graduation_paths": [
    {
      "id": "bachelor",
      "name": "Kỹ thuật Điều khiển - Tự động hóa 2023 (Cử nhân)",
      "raw_expression": "Các khối tính tốt nghiệp theo mức công bố: Toán và Khoa học cơ bản: 32.0 TC; Cơ sở và cốt lõi ngành: 47.0 TC; Thực tập & tốt nghiệp: 8.0 TC; Lý luận chính trị & Pháp luật: 13.0 TC; Kiến thức bổ trợ: 9.0 TC. Chuyên ngành (chọn 1 mô đun).",
      "components": [
        {
          "type": "GROUP_CREDITS",
          "group_id": "group_khoi_1",
          "required_credits": 32
        },
        {
          "type": "GROUP_CREDITS",
          "group_id": "group_khoi_2",
          "required_credits": 47
        },
        {
          "type": "GROUP_CREDITS",
          "group_id": "group_khoi_3",
          "required_credits": 8
        },
        {
          "type": "GROUP_CREDITS",
          "group_id": "group_khoi_4",
          "required_credits": 13
        },
        {
          "type": "GROUP_CREDITS",
          "group_id": "group_khoi_5",
          "required_credits": 9
        },
        {
          "type": "ONE_OF_GROUPS",
          "required_credits": 23,
          "options": [
            {
              "group_id": "group_mod_1",
              "required_credits": 23
            },
            {
              "group_id": "group_mod_2",
              "required_credits": 23
            },
            {
              "group_id": "group_mod_3",
              "required_credits": 23
            }
          ]
        }
      ],
      "total_required_credits": 132,
      "source_order": 0
    }
  ],
  "groups": [
    {
      "id": "group_khoi_1",
      "source_group_code": "KHOI1",
      "name": "Toán và Khoa học cơ bản",
      "course_count_reported": 10,
      "catalog_credits": 32,
      "course_codes": [
        "MI1111",
        "MI1141",
        "IT1110",
        "MI1121",
        "MI2020",
        "PH1110",
        "MI1131",
        "MI2110",
        "PH1120",
        "PH1131"
      ],
      "counts_toward_degree_credits": true
    },
    {
      "id": "group_khoi_2",
      "source_group_code": "KHOI2",
      "name": "Cơ sở và cốt lõi ngành",
      "course_count_reported": 17,
      "catalog_credits": 47,
      "course_codes": [
        "EE1026",
        "EE2000",
        "EE2021",
        "EE2031",
        "EE2022",
        "EE2110",
        "EE3140",
        "EE3288",
        "EE3410",
        "EE2130",
        "EE3110",
        "EE3491",
        "EE3510",
        "EE3816",
        "EE3480",
        "EE3826",
        "EE3426"
      ],
      "counts_toward_degree_credits": true
    },
    {
      "id": "group_khoi_3",
      "source_group_code": "KHOI3",
      "name": "Thực tập & tốt nghiệp",
      "course_count_reported": 2,
      "catalog_credits": 8,
      "course_codes": [
        "EE3916",
        "EE4906"
      ],
      "counts_toward_degree_credits": true
    },
    {
      "id": "group_khoi_4",
      "source_group_code": "KHOI4",
      "name": "Lý luận chính trị & Pháp luật",
      "course_count_reported": 6,
      "catalog_credits": 13,
      "course_codes": [
        "SSH1111",
        "SSH1121",
        "EM1170",
        "SSH1131",
        "SSH1141",
        "SSH1151"
      ],
      "counts_toward_degree_credits": true
    },
    {
      "id": "group_khoi_5",
      "source_group_code": "KHOI5",
      "name": "Kiến thức bổ trợ",
      "course_count_reported": 9,
      "catalog_credits": 19,
      "course_codes": [
        "EE2023",
        "CH2021",
        "ED3220",
        "ED3280",
        "EM1010",
        "EM1180",
        "ET3262",
        "ME3123",
        "ME3124"
      ],
      "counts_toward_degree_credits": true
    },
    {
      "id": "group_khoi_6",
      "source_group_code": "KHOI6",
      "name": "Ngoại ngữ",
      "course_count_reported": 5,
      "catalog_credits": 20,
      "course_codes": [
        "FL1131",
        "FL1132",
        "FL1133",
        "FL1134",
        "FL1135"
      ],
      "counts_toward_degree_credits": false
    },
    {
      "id": "group_khoi_7",
      "source_group_code": "KHOI7",
      "name": "Giáo dục thể chất",
      "course_count_reported": 1,
      "catalog_credits": 0,
      "course_codes": [
        "PE1014"
      ],
      "counts_toward_degree_credits": false
    },
    {
      "id": "group_khoi_8",
      "source_group_code": "KHOI8",
      "name": "Giáo dục Quốc phòng – An ninh",
      "course_count_reported": 4,
      "catalog_credits": 0,
      "course_codes": [
        "MIL1210",
        "MIL1220",
        "MIL1230",
        "MIL1240"
      ],
      "counts_toward_degree_credits": false
    },
    {
      "id": "group_mod_1",
      "source_group_code": "MOD1",
      "name": "Mô đun 1: Tự động hóa công nghiệp",
      "course_count_reported": 9,
      "catalog_credits": 23,
      "course_codes": [
        "EE4220",
        "EE3550",
        "EE3600",
        "EE4335",
        "EE4331",
        "EE4332",
        "EE4334",
        "EE4343",
        "EE4333"
      ],
      "counts_toward_degree_credits": true
    },
    {
      "id": "group_mod_2",
      "source_group_code": "MOD2",
      "name": "Mô đun 2: Điều khiển tự động",
      "course_count_reported": 9,
      "catalog_credits": 23,
      "course_codes": [
        "EE4220",
        "EE3550",
        "EE3600",
        "EE4335",
        "EE4401",
        "EE4430",
        "EE4435",
        "EE4343",
        "EE4166"
      ],
      "counts_toward_degree_credits": true
    },
    {
      "id": "group_mod_3",
      "source_group_code": "MOD3",
      "name": "Mô đun 3: Đo lường và tin học công nghiệp",
      "course_count_reported": 9,
      "catalog_credits": 23,
      "course_codes": [
        "EE4220",
        "EE3550",
        "EE3600",
        "EE4335",
        "EE4251",
        "EE4502",
        "EE4552",
        "EE4343",
        "EE4532"
      ],
      "counts_toward_degree_credits": true
    }
  ],
  "courses": [
    {
      "code": "MI1111",
      "name": "Giải tích I",
      "credits": 4,
      "suggested_semester": 1,
      "is_compulsory": true,
      "category": "Toán và Khoa học cơ bản",
      "department": "KTTD",
      "group_ids": [
        "group_khoi_1"
      ],
      "registration_condition": {
        "raw": "",
        "any_of": []
      }
    },
    {
      "code": "MI1141",
      "name": "Đại số",
      "credits": 4,
      "suggested_semester": 1,
      "is_compulsory": true,
      "category": "Toán và Khoa học cơ bản",
      "department": "KTTD",
      "group_ids": [
        "group_khoi_1"
      ],
      "registration_condition": {
        "raw": "",
        "any_of": []
      }
    },
    {
      "code": "IT1110",
      "name": "Tin học đại cương",
      "credits": 4,
      "suggested_semester": 1,
      "is_compulsory": true,
      "category": "Toán và Khoa học cơ bản",
      "department": "TCNTT",
      "group_ids": [
        "group_khoi_1"
      ],
      "registration_condition": {
        "raw": "",
        "any_of": []
      }
    },
    {
      "code": "MI1121",
      "name": "Giải tích II",
      "credits": 3,
      "suggested_semester": 2,
      "is_compulsory": true,
      "category": "Toán và Khoa học cơ bản",
      "department": "KTTD",
      "group_ids": [
        "group_khoi_1"
      ],
      "registration_condition": {
        "raw": "",
        "any_of": []
      }
    },
    {
      "code": "MI2020",
      "name": "Xác suất thống kê",
      "credits": 3,
      "suggested_semester": 2,
      "is_compulsory": true,
      "category": "Toán và Khoa học cơ bản",
      "department": "KTTD",
      "group_ids": [
        "group_khoi_1"
      ],
      "registration_condition": {
        "raw": "",
        "any_of": []
      }
    },
    {
      "code": "PH1110",
      "name": "Vật lý đại cương I",
      "credits": 3,
      "suggested_semester": 2,
      "is_compulsory": true,
      "category": "Toán và Khoa học cơ bản",
      "department": "VVLKT",
      "group_ids": [
        "group_khoi_1"
      ],
      "registration_condition": {
        "raw": "",
        "any_of": []
      }
    },
    {
      "code": "MI1131",
      "name": "Giải tích III",
      "credits": 3,
      "suggested_semester": 3,
      "is_compulsory": true,
      "category": "Toán và Khoa học cơ bản",
      "department": "KTTD",
      "group_ids": [
        "group_khoi_1"
      ],
      "registration_condition": {
        "raw": "",
        "any_of": []
      }
    },
    {
      "code": "MI2110",
      "name": "Phương pháp tính và MATLAB",
      "credits": 3,
      "suggested_semester": 3,
      "is_compulsory": true,
      "category": "Toán và Khoa học cơ bản",
      "department": "KTTD",
      "group_ids": [
        "group_khoi_1"
      ],
      "registration_condition": {
        "raw": "",
        "any_of": []
      }
    },
    {
      "code": "PH1120",
      "name": "Vật lý đại cương II",
      "credits": 3,
      "suggested_semester": 3,
      "is_compulsory": true,
      "category": "Toán và Khoa học cơ bản",
      "department": "VVLKT",
      "group_ids": [
        "group_khoi_1"
      ],
      "registration_condition": {
        "raw": "",
        "any_of": []
      }
    },
    {
      "code": "PH1131",
      "name": "Vật lý đại cương III",
      "credits": 2,
      "suggested_semester": 4,
      "is_compulsory": true,
      "category": "Toán và Khoa học cơ bản",